{
  "skill": "code",
  "run_id": "TKT-1",
  "iteration": 1,
  "reviewed_sha": "9f1c2ab7d4e5063b1c8a2f90d7e4b615a3c0d829",
  "lens": null,
  "passed": false,
  "findings": [
    {
      "id": "F-1-1",
      "status": "confirmed",
      "severity": "blocking",
      "kind": "gate",
      "lens": "A",
      "file": "tests/test_login.py",
      "line": 22,
      "claim": "three specs fail on the session path this changeset rewrote",
      "evidence": [
        "pytest -q -> 3 failed, 9 passed",
        "tests/test_login.py:22-41"
      ],
      "traces_to": [
        "AC-1"
      ],
      "adjudication": {
        "verdict": "confirmed",
        "reason": "the failure reproduces on a clean checkout"
      }
    }
  ],
  "written_at": "2026-01-01T00:00:00Z"
}
