{
  "skill": "code",
  "run_id": "TKT-1",
  "iteration": 1,
  "reviewed_sha": "9f1c2ab7d4e5063b1c8a2f90d7e4b615a3c0d829",
  "lens": "A",
  "passed": true,
  "findings": [
    {
      "id": "F-1-1",
      "status": "advisory",
      "severity": "advisory",
      "kind": "craft",
      "lens": "A",
      "file": "src/login/session.py",
      "line": 42,
      "claim": "the retry helper repeats a backoff table two other modules already carry",
      "evidence": [
        "src/login/session.py:42-58",
        "src/auth/backoff.py:11-27"
      ],
      "resolved_when": "the backoff table has one definition the three call sites share",
      "traces_to": [
        "AC-2"
      ],
      "adjudication": {
        "verdict": "needs-context",
        "reason": "the duplication predates this changeset"
      }
    }
  ],
  "written_at": "2026-01-01T00:00:00Z"
}
