{
  "skill": "code",
  "run_id": "TKT-1",
  "iteration": 1,
  "reviewed_sha": "9f1c2ab7d4e5063b1c8a2f90d7e4b615a3c0d829",
  "lens": null,
  "passed": true,
  "findings": [],
  "written_at": "2026-01-01T00:00:00Z",
  "tests": {
    "passed": 12,
    "failed": 0,
    "command": "pytest -q"
  },
  "coverage": {
    "percent": 93.4,
    "command": "pytest -q --cov=src"
  }
}
